<?xml version="1.0" encoding="UTF-8"?>
<test-data
    xmlns="http://pmd.sourceforge.net/rule-tests"
    xmlns:xsi="http://www.w3.org/2001/XMLSchema-instance"
    xsi:schemaLocation="http://pmd.sourceforge.net/rule-tests http://pmd.sourceforge.net/rule-tests_1_0_0.xsd">
    <test-code>
	    <description>Test case in issue 3625</description>
	    <expected-problems>1</expected-problems>
	    <code><![CDATA[
public class Main {
	public void func() {
		final String var = "";
		String test = var + "123"; // should report a warning here
	}
}

	    ]]></code>
    </test-code>
    <test-code>
	    <description>Local Variables be empty String</description>
	    <expected-problems>3</expected-problems>
	    <code><![CDATA[
public class Main
{
	public static void main(String[] args)
	{
		String string1 = "";
		String string2 = "";
		String string3 = "";

		String a = string1 + 114;
		String b = string2 + 514;
		String c = string3 + 1919810;
	}
}
	    ]]></code>
    </test-code>
    <test-code>
	    <description>Local and global variables be empty String</description>
	    <expected-problems>4</expected-problems>
	    <code><![CDATA[
public class Main
{
	final String outerString1 = "";
	final String outerString2 = "";

	public static void main(String[] args)
	{
		final String innerString1 = "";
		final String innerString2 = "";

		String a = outerString1 + 114;
		String b = outerString2 + 514;
		String c = innerString1 + 1919;
		String d = innerString2 + 810;
	}
}
	    ]]></code>
    </test-code>
    <test-code>
	    <description>Test case in issue 3625</description>
	    <expected-problems>1</expected-problems>
	    <code><![CDATA[
public class Main {
	public void func() {
		final String var = "";
		String test = var + "123"; // should report a warning here
	}
}

	    ]]></code>
    </test-code>
    <test-code>
        <description>Bad add</description>
        <expected-problems>1</expected-problems>
        <code><![CDATA[
public class Foo {
    void bar() {
        String s = "" + 123;
    }
}
        ]]></code>
    </test-code>

    <test-code>
        <description>Good add</description>
        <expected-problems>0</expected-problems>
        <code><![CDATA[
public class Foo {
    void bar() {
        String s = "1" + 123;
    }
}
        ]]></code>
    </test-code>

    <test-code>
        <description>Good convert</description>
        <expected-problems>0</expected-problems>
        <code><![CDATA[
public class Foo {
    void bar() {
        String t = Integer.toString(456);
    }
}
        ]]></code>
    </test-code>

    <test-code>
        <description>Ignore in annotations</description>
        <expected-problems>0</expected-problems>
        <code><![CDATA[
public class Foo {
    private static final int VERSION = 1;

    @Deprecated(since = "" + VERSION)
    public void foo() {
    }
}
        ]]></code>
    </test-code>
</test-data>
